{
  "id": "ideas-i-husserl",
  "title": { "fr": "Idées directrices pour une phénoménologie (Ideen I)", "en": "Ideas Pertaining to a Pure Phenomenology (Ideas I)" },
  "originalTitle": "Ideen zu einer reinen Phänomenologie",
  "author": { "slug": "husserl", "name": { "fr": "Husserl", "en": "Husserl" } },
  "year": 1913,
  "presentation": {
    "fr": "Exposé du tournant transcendantal de la phénoménologie : Husserl y présente la réduction phénoménologique, la suspension de l'attitude naturelle et l'analyse de la conscience comme intentionnalité, ouverte sur ses objets visés.",
    "en": "The statement of phenomenology's transcendental turn: Husserl sets out the phenomenological reduction, the suspension of the natural attitude, and the analysis of consciousness as intentionality, open onto the objects it intends."
  },
  "updatedAt": "2026-06-29T00:00:00.000Z"
}
