{
  "id": "what-is-enlightenment-kant",
  "title": { "fr": "Qu'est-ce que les Lumières ?", "en": "What Is Enlightenment?" },
  "author": { "slug": "kant", "name": { "fr": "Kant", "en": "Kant" } },
  "year": 1784,
  "presentation": {
    "fr": "Bref essai célèbre où Kant définit les Lumières comme la sortie de l'homme hors de sa minorité dont il est lui-même responsable, sous la devise « Sapere aude ». Il y distingue l'usage public de la raison, qui doit être libre, de son usage privé.",
    "en": "A famous short essay where Kant defines Enlightenment as the human being's emergence from his self-incurred immaturity, under the motto \"Sapere aude\". It distinguishes the public use of reason, which must be free, from its private use."
  },
  "updatedAt": "2026-06-17T00:00:00.000Z"
}
