{
  "id": "how-to-make-our-ideas-clear-peirce",
  "title": { "fr": "Comment rendre nos idées claires", "en": "How to Make Our Ideas Clear" },
  "originalTitle": "How to Make Our Ideas Clear",
  "author": { "slug": "peirce", "name": { "fr": "Charles Sanders Peirce", "en": "Charles Sanders Peirce" } },
  "year": 1878,
  "presentation": {
    "fr": "L'article fondateur du pragmatisme, où Peirce énonce sa maxime : pour clarifier une idée, considérer quels effets pratiques concevables aurait son objet ; tout le sens de la conception tient dans ces effets. La vérité y est définie comme l'opinion vers laquelle l'enquête est destinée à converger.",
    "en": "The founding essay of pragmatism, where Peirce states his maxim: to clarify an idea, consider what conceivable practical effects its object would have; the whole meaning of the conception lies in those effects. Truth is there defined as the opinion fated to be agreed upon at the end of inquiry."
  },
  "updatedAt": "2026-06-29T00:00:00.000Z"
}
