{
  "id": "thus-spoke-zarathustra-nietzsche",
  "title": { "fr": "Ainsi parlait Zarathoustra", "en": "Thus Spoke Zarathustra" },
  "author": { "slug": "nietzsche", "name": { "fr": "Nietzsche", "en": "Nietzsche" } },
  "year": 1883,
  "presentation": {
    "fr": "Poème philosophique en forme de récit, il met en scène le prophète Zarathoustra annonçant le surhumain, l'éternel retour et la fidélité à la terre. C'est l'œuvre la plus littéraire et la plus personnelle de Nietzsche.",
    "en": "A philosophical poem in narrative form, it stages the prophet Zarathustra proclaiming the overhuman, eternal recurrence, and faithfulness to the earth. It is Nietzsche's most literary and personal work."
  },
  "updatedAt": "2026-06-17T00:00:00.000Z"
}
