{
  "id": "enquiry-concerning-human-understanding-hume",
  "title": { "fr": "Enquête sur l'entendement humain", "en": "An Enquiry Concerning Human Understanding" },
  "author": { "slug": "hume", "name": { "fr": "David Hume", "en": "David Hume" } },
  "year": 1748,
  "presentation": {
    "fr": "La reprise plus accessible des thèses du Traité, devenue le classique de l'empirisme sceptique de Hume. Il y développe le problème de l'<arg>induction</arg>, son analyse de la causalité et sa célèbre maxime selon laquelle le sage proportionne sa croyance aux preuves.",
    "en": "The more accessible recasting of the Treatise's theses, which became the classic of Hume's sceptical empiricism. He there develops the problem of <arg>induction</arg>, his analysis of causation, and his famous maxim that the wise man proportions his belief to the evidence."
  },
  "updatedAt": "2026-06-17T00:00:00.000Z"
}
