{
  "id": "on-liberty-mill",
  "title": { "fr": "De la liberté", "en": "On Liberty" },
  "originalTitle": "On Liberty",
  "author": { "slug": "mill", "name": { "fr": "Mill", "en": "Mill" } },
  "year": 1859,
  "presentation": {
    "fr": "Le grand plaidoyer libéral pour la liberté individuelle. Mill y formule le « principe de non-nuisance » : la seule raison légitime de contraindre quelqu'un contre son gré est d'empêcher qu'il nuise à autrui ; son propre bien, physique ou moral, n'y suffit jamais. Sur ce qui ne regarde que lui, l'individu est souverain.",
    "en": "The great liberal plea for individual liberty. Mill formulates there the 'harm principle': the only legitimate reason to coerce someone against their will is to prevent harm to others; their own good, physical or moral, is never sufficient warrant. Over what concerns only himself, the individual is sovereign."
  },
  "updatedAt": "2026-07-15T00:00:00.000Z"
}
