{
  "id": "on-the-genealogy-of-morality-nietzsche",
  "title": { "fr": "Généalogie de la morale", "en": "On the Genealogy of Morality" },
  "author": { "slug": "nietzsche", "name": { "fr": "Nietzsche", "en": "Nietzsche" } },
  "year": 1887,
  "presentation": {
    "fr": "En trois dissertations, Nietzsche retrace l'origine basse et contingente de nos valeurs morales : l'opposition maîtres / esclaves, la fabrique de la mauvaise conscience et la signification de l'idéal ascétique. C'est l'exposé le plus systématique de sa méthode généalogique.",
    "en": "In three essays, Nietzsche traces the low and contingent origin of our moral values: the master / slave opposition, the making of bad conscience, and the meaning of the ascetic ideal. It is the most systematic statement of his genealogical method."
  },
  "updatedAt": "2026-06-17T00:00:00.000Z"
}
