{
  "id": "civilization-and-its-discontents-freud",
  "title": { "fr": "Malaise dans la civilisation", "en": "Civilization and Its Discontents" },
  "originalTitle": "Das Unbehagen in der Kultur",
  "author": { "slug": "freud", "name": { "fr": "Freud", "en": "Freud" } },
  "year": 1930,
  "presentation": {
    "fr": "Freud y soutient que la civilisation se paie d'un malaise durable : pour vivre ensemble, les hommes doivent réprimer des pulsions puissantes, dont une agressivité native que la culture n'efface pas mais retourne contre le sujet, sous la forme de la culpabilité. « L'homme est un loup pour l'homme » : la vie commune est une digue élevée contre ce fond pulsionnel.",
    "en": "Freud argues that civilization comes at the price of a lasting discontent: to live together, humans must repress powerful drives, among them a native aggressiveness that culture does not erase but turns back against the self, as guilt. 'Man is a wolf to man': common life is a dam raised against this drive-laden depth."
  },
  "updatedAt": "2026-07-15T00:00:00.000Z"
}
