{
  "id": "gorgias-plato",
  "title": { "fr": "Gorgias", "en": "Gorgias" },
  "originalTitle": "Γοργίας",
  "author": { "slug": "plato", "name": { "fr": "Platon", "en": "Plato" } },
  "year": -380,
  "presentation": {
    "fr": "Dialogue où Socrate affronte le rhéteur Gorgias, puis Polos et Calliclès, sur la valeur de la rhétorique et sur la vie bonne ; il y défend qu'il vaut mieux subir l'injustice que la commettre, contre la thèse du droit du plus fort.",
    "en": "A dialogue in which Socrates confronts the rhetorician Gorgias, then Polus and Callicles, over the worth of rhetoric and the good life; he argues that it is better to suffer injustice than to commit it, against the thesis of the right of the stronger."
  },
  "updatedAt": "2026-07-07T00:00:00.000Z"
}
