{
  "id": "on-the-freedom-of-the-will-schopenhauer",
  "title": {
    "fr": "Essai sur le libre arbitre",
    "en": "On the Freedom of the Will"
  },
  "originalTitle": "Über die Freiheit des menschlichen Willens",
  "author": { "slug": "schopenhauer", "name": { "fr": "Schopenhauer", "en": "Schopenhauer" } },
  "year": 1839,
  "presentation": {
    "fr": "Mémoire couronné par la Société royale des sciences de Norvège, qui établit que tout acte suit nécessairement du caractère et des motifs : la liberté d'indifférence est une illusion, mais la responsabilité tient au caractère intelligible hérité de Kant.",
    "en": "A prize essay crowned by the Royal Norwegian Society of Sciences, establishing that every act follows necessarily from character and motives: the freedom of indifference is an illusion, yet responsibility rests on the intelligible character inherited from Kant."
  },
  "updatedAt": "2026-07-13T00:00:00.000Z"
}
