{
  "id": "laws-plato",
  "title": { "fr": "Lois", "en": "Laws" },
  "author": { "slug": "plato", "name": { "fr": "Platon", "en": "Plato" } },
  "year": -350,
  "presentation": {
    "fr": "Dernier et plus long dialogue de Platon, qui détaille les lois et les institutions d'une cité concrète, plus pragmatique que la cité idéale de la République.",
    "en": "Plato's last and longest dialogue, laying out in detail the laws and institutions of a concrete city, more pragmatic than the ideal state of the Republic."
  },
  "updatedAt": "2026-06-17T00:00:00.000Z"
}
