{
  "id": "enquiry-concerning-the-principles-of-morals-hume",
  "title": { "fr": "Enquête sur les principes de la morale", "en": "An Enquiry Concerning the Principles of Morals" },
  "author": { "slug": "hume", "name": { "fr": "David Hume", "en": "David Hume" } },
  "year": 1751,
  "presentation": {
    "fr": "L'exposé mûr de la morale de Hume, qu'il tenait pour son meilleur ouvrage. Il y fait dériver les vertus de leur utilité et de leur agrément ressentis, ancrant les distinctions morales dans le <c>sentiment</c> plutôt que dans la raison.",
    "en": "Hume's mature statement of his moral philosophy, which he regarded as his best work. He there derives the virtues from their felt usefulness and agreeableness, anchoring moral distinctions in <c>sentiment</c> rather than reason."
  },
  "updatedAt": "2026-06-17T00:00:00.000Z"
}
