{
  "id": "the-passions-of-the-soul-descartes",
  "title": { "fr": "Les passions de l'âme", "en": "The Passions of the Soul" },
  "author": { "slug": "descartes", "name": { "fr": "Descartes", "en": "Descartes" } },
  "year": 1649,
  "presentation": {
    "fr": "Dernier ouvrage publié par Descartes, il analyse les passions comme des phénomènes à la fois physiologiques et mentaux, et propose une morale fondée sur la maîtrise de soi par la raison.",
    "en": "Descartes' last published work, it analyses the passions as phenomena that are at once physiological and mental, and proposes an ethics grounded in self-mastery through reason."
  },
  "updatedAt": "2026-06-17T00:00:00.000Z"
}
