{
  "id": "letters-to-lucilius-seneca",
  "title": { "fr": "Lettres à Lucilius", "en": "Letters to Lucilius" },
  "author": { "slug": "seneca", "name": { "fr": "Sénèque", "en": "Seneca" } },
  "year": 64,
  "presentation": {
    "fr": "Recueil de cent vingt-quatre lettres morales adressées par Sénèque à son ami Lucilius, c'est l'œuvre majeure du stoïcisme romain tardif. Chaque lettre traite, sur un ton intime, d'un thème de la vie sage : le temps, la mort, la richesse ou l'amitié.",
    "en": "A collection of one hundred and twenty-four moral letters Seneca addressed to his friend Lucilius, it is the major work of late Roman Stoicism. Each letter treats, in an intimate tone, a theme of the wise life: time, death, wealth, or friendship."
  },
  "updatedAt": "2026-06-17T00:00:00.000Z"
}
