{
  "id": "the-rebel-camus",
  "title": { "fr": "L'Homme révolté", "en": "The Rebel" },
  "author": { "slug": "camus", "name": { "fr": "Camus", "en": "Camus" } },
  "year": 1951,
  "presentation": {
    "fr": "Essai où <ph id='camus'>Camus</ph> prolonge <c id='the-absurd'>l'absurde</c> en une pensée de la révolte : dire non à l'intolérable fait surgir une valeur commune à tous les hommes, « je me révolte, donc nous sommes ». Il y critique les idéologies révolutionnaires qui sacrifient les vivants à l'Histoire et plaide pour une pensée des limites et de la mesure.",
    "en": "An essay in which <ph id='camus'>Camus</ph> extends <c id='the-absurd'>the absurd</c> into a philosophy of revolt: to say no to the intolerable brings forth a value common to all men, \"I rebel, therefore we are\". He criticizes the revolutionary ideologies that sacrifice the living to History and pleads for a thought of limits and measure."
  },
  "updatedAt": "2026-06-17T00:00:00.000Z"
}
