{
  "id": "the-myth-of-sisyphus-camus",
  "title": { "fr": "Le Mythe de Sisyphe", "en": "The Myth of Sisyphus" },
  "author": { "slug": "camus", "name": { "fr": "Camus", "en": "Camus" } },
  "year": 1942,
  "presentation": {
    "fr": "Essai où <ph id='camus'>Camus</ph> pose la question du suicide à partir de <c id='the-absurd'>l'absurde</c>, ce divorce entre l'exigence humaine de sens et le silence du monde. Contre l'esquive du suicide comme du saut de la foi, il y défend une révolte lucide, dont Sisyphe poussant éternellement son rocher est la figure heureuse.",
    "en": "An essay in which <ph id='camus'>Camus</ph> raises the question of suicide on the basis of <c id='the-absurd'>the absurd</c>, that divorce between the human demand for meaning and the silence of the world. Against the evasion of suicide and of the leap of faith alike, he defends a lucid revolt, of which Sisyphus eternally rolling his rock is the happy figure."
  },
  "updatedAt": "2026-06-17T00:00:00.000Z"
}
