{
  "id": "the-world-as-will-and-representation-schopenhauer",
  "title": {
    "fr": "Le Monde comme volonté et comme représentation",
    "en": "The World as Will and Representation"
  },
  "originalTitle": "Die Welt als Wille und Vorstellung",
  "author": { "slug": "schopenhauer", "name": { "fr": "Schopenhauer", "en": "Schopenhauer" } },
  "year": 1818,
  "presentation": {
    "fr": "L'unique système de Schopenhauer, en quatre livres : le monde comme représentation, comme volonté, la contemplation esthétique des Idées, enfin l'éthique de la compassion et la négation du vouloir-vivre. Longtemps ignorée, l'œuvre est augmentée en 1844 d'un second tome de compléments.",
    "en": "Schopenhauer's single system, in four books: the world as representation, as will, the aesthetic contemplation of the Ideas, and finally the ethics of compassion and the denial of the will-to-live. Long ignored, the work was expanded in 1844 with a second volume of supplements."
  },
  "updatedAt": "2026-07-13T00:00:00.000Z"
}
